{"standard":"vibori-candidate/v1","source":{"url":"https://www.iditena.org/districts/192/","retrieved_at":"2026-09-23T16:41:23.833624+00:00","publisher":"IditeNa.org"},"id":"entity-7fc5736d36","name":"Ковалёв Антон Иванович","election_id":"izbirkom-587813923-p1","party":{"id":"party-united-russia","name":"Единая Россия"},"district_number":192}
