{"standard":"vibori-candidate/v1","source":{"url":"https://www.iditena.org/districts/203/","retrieved_at":"2026-09-23T16:41:24.156417+00:00","publisher":"IditeNa.org"},"id":"entity-1ec11cffca","name":"Мысив Олеся Вячеславовна","election_id":"izbirkom-587813923-p1","party":{"id":"party-communists-russia","name":"Коммунисты России"},"district_number":203}
