{"standard":"vibori-candidate/v1","source":{"url":"https://www.iditena.org/districts/181/","retrieved_at":"2026-09-23T16:41:23.525153+00:00","publisher":"IditeNa.org"},"id":"entity-daa684742d","name":"Галанцев Евгений Александрович","election_id":"izbirkom-587813923-p1","party":{"id":"party-rodina","name":"Родина"},"district_number":181}
